{
  "$schema": "../schema/task.schema.json",
  "id": "export-registry",
  "name": "Export lesson registry to worksheet repo",
  "type": "node-script",
  "worker": "scripts/export-registry.mjs",
  "inputs": {},
  "outputs": {
    "registry_key": "registryExported"
  },
  "preconditions": {
    "registry_status": { "key": "registryExported", "not": "done" }
  },
  "on_failure": {
    "strategy": "skip"
  },
  "timeout_minutes": 2
}
